{
  "$schema": "https://json-schema.org/draft/2020-12/schema",
  "title": "quality",
  "type": "object",
  "additionalProperties": false,
  "required": ["schema_version", "kind", "generated_at", "release_id", "window", "checks", "sli"],
  "properties": {
    "schema_version": {"const": 1},
    "kind": {"const": "quality"},
    "generated_at": {"type": "string", "pattern": "^\\d{4}-\\d{2}-\\d{2}T\\d{2}:\\d{2}:\\d{2}Z$"},
    "release_id": {"type": "string", "pattern": "^\\d{4}-\\d{2}-\\d{2}-[0-9a-f]{16}$"},
    "window": {
      "type": "object",
      "additionalProperties": false,
      "required": ["start", "end", "days"],
      "properties": {
        "start": {"type": "string", "pattern": "^\\d{4}-\\d{2}-\\d{2}$"},
        "end": {"type": "string", "pattern": "^\\d{4}-\\d{2}-\\d{2}$"},
        "days": {"type": "integer", "minimum": 1, "maximum": 7}
      }
    },
    "checks": {
      "type": "object",
      "additionalProperties": false,
      "required": ["all_passed", "items"],
      "properties": {
        "all_passed": {"type": "boolean"},
        "items": {
          "type": "array",
          "minItems": 1,
          "items": {
            "type": "object",
            "additionalProperties": false,
            "required": ["id", "passed"],
            "properties": {
              "id": {"type": "string", "minLength": 1},
              "passed": {"type": "boolean"},
              "detail": {"type": "string"}
            }
          }
        }
      }
    },
    "sli": {
      "type": "object",
      "additionalProperties": false,
      "required": ["days", "totals", "hero_count", "build_count", "card_count", "uncovered_card_count"],
      "properties": {
        "days": {
          "type": "array",
          "minItems": 1,
          "items": {
            "type": "object",
            "additionalProperties": false,
            "required": ["day", "row_counts"],
            "properties": {
              "day": {"type": "string", "pattern": "^\\d{4}-\\d{2}-\\d{2}$"},
              "row_counts": {"$ref": "#/$defs/rowCounts"}
            }
          }
        },
        "totals": {"$ref": "#/$defs/rowCounts"},
        "hero_count": {"type": "integer", "minimum": 0},
        "build_count": {"type": "integer", "minimum": 0},
        "card_count": {"type": "integer", "minimum": 0},
        "uncovered_card_count": {"type": "integer", "minimum": 0}
      }
    }
  },
  "$defs": {
    "rowCounts": {
      "type": "object",
      "additionalProperties": false,
      "required": ["runs", "battles", "battle_cards", "quality", "quarantine"],
      "properties": {
        "runs": {"type": "integer", "minimum": 0},
        "battles": {"type": "integer", "minimum": 0},
        "battle_cards": {"type": "integer", "minimum": 0},
        "quality": {"type": "integer", "minimum": 0},
        "quarantine": {"type": "integer", "minimum": 0}
      }
    }
  }
}
