{"checks":{"all_passed":true,"items":[{"detail":"window is consecutive, anchored, and epoch-clamped","id":"8","passed":true},{"detail":"all five payload kinds validated before promotion","id":"9","passed":true},{"detail":"manifest inventory matches the exact staged file set","id":"10","passed":true},{"detail":"release identity is prefixed by the anchor day","id":"11","passed":true}]},"generated_at":"2026-08-12T00:00:00Z","kind":"quality","release_id":"2026-08-11-ba4e1cac4545762d","schema_version":1,"sli":{"build_count":4600,"card_count":1026,"days":[{"day":"2026-08-07","row_counts":{"battle_cards":11637522,"battles":434225,"quality":43018,"quarantine":0,"runs":39917}},{"day":"2026-08-08","row_counts":{"battle_cards":14463231,"battles":540238,"quality":52722,"quarantine":0,"runs":48876}},{"day":"2026-08-09","row_counts":{"battle_cards":15385070,"battles":577775,"quality":55662,"quarantine":0,"runs":51880}},{"day":"2026-08-10","row_counts":{"battle_cards":13845425,"battles":524401,"quality":50052,"quarantine":0,"runs":46855}},{"day":"2026-08-11","row_counts":{"battle_cards":13371906,"battles":507392,"quality":48614,"quarantine":0,"runs":45145}}],"hero_count":8,"totals":{"battle_cards":68703154,"battles":2584031,"quality":250068,"quarantine":0,"runs":232673},"uncovered_card_count":0},"window":{"days":5,"end":"2026-08-11","start":"2026-08-07"}}
